<?xml version="1.0" encoding="UTF-8"?>
<kontakt:kontakt xmlns:xsi="http://www.w3.org/2001/XMLSchema-instance" 
xmlns:kontakt="https://ofn.gov.cz/kontakty/"
xmlns:x="https://příklad.cz"
xmlns:umístění="https://ofn.gov.cz/umístění/"
xsi:schemaLocation="https://ofn.gov.cz/kontakty/ https://ofn.gov.cz/kontakty/draft/schémata/kontakt.xsd">
    <kontakt:druh xml:lang="cs">Neformální</kontakt:druh>
    <kontakt:druh xml:lang="en">Informal</kontakt:druh>
    <kontakt:email>otevrenadata@mvcr.cz</kontakt:email>
    <kontakt:idds>abcdef</kontakt:idds>
    <kontakt:mobil>+420123456789</kontakt:mobil>
    <kontakt:telefon>+420123456789</kontakt:telefon>
    <kontakt:url>https://data.gov.cz</kontakt:url>
    <kontakt:umístění>
        <umístění:adresa>
            <adresa:iri_adresního_místa>https://linked.cuzk.cz/resource/ruian/adresni-misto/16135661</adresa:iri_adresního_místa>
        </umístění:adresa>
    </kontakt:umístění> 
</kontakt:kontakt>
